{
  "schema_version": "0.1.0",
  "directive_id": "DIR-900001",
  "run_id": "RUN-OFS001-PILOT-003",
  "work_item_id": "WORK-000013",
  "created_by_agent_id": "orchestrator-local-01",
  "applied_at": "2026-08-23T17:36:54.956618Z",
  "directive_digest": "d31ed703e255839ce5a3145082bbc2ed068fcc47d71345583a079554a9107a16",
  "instruction_digest": "3d25e815885f076ea2f9936f82edf5985a3bb867093d977adcbcd7ea19a2b8f2",
  "scope": [
    "OFS-001"
  ],
  "authorization_bounds": {
    "information_plane": "public",
    "publication_approved": false,
    "high_impact_recommendation_approved": false,
    "policy_change_approved": false
  },
  "status": "applied"
}
